Titre,Votes,Answers
Beautiful Soup class extraction,0,0
Use Python to Parse HTML from dynamic js webpage with qt5 and Beautifulsoup [duplicate],votes,0
Extracting data from HTML Tables using Curl,0,19
Scraping information from Booking.com,votes,0
Auto increment web site url number [closed],-1,0
Selenium cant find element,votes,9
How do I edit attritubes of HTML tags using Beautiful Soup,1,-1
is there is a way to fetch data from a webpage that requires login,vote,1
runspider returns an empty file [DEBUG: Crawled (200)],-3,34
How to we scrap the pages that have links and each link opens the records? [closed],votes,1
"Scraping a table with pagination, but couldn't seem to find the next table on the next active page",-1,2
Python - Extracting info from website using BeautifulSoup,votes,24
How to put each link separate in database with beautifulsoup python,0,-3
Python Scrap Same item from all subpages using BeautifulSoup,votes,0
Scraping: No attribute find_all for <p>,0,21
How to Scrape Json Text Format using Python,votes,-1
Not able to extract href from anchor tag using python Beautifulsoup,0,3
How to avoid AttributeError: 'NoneType' object has no attribute 'text' webscraping subreddits?,votes,35
I get a problem when I try to scrape to the bottom of the page selenium,0,0
Replace XML variables which have the the same text with another text variable in python,votes,2
How to accept cookies with requests,-1,48
I get a problem when scraping linkedin sales navigator,votes,0
How to Web Scrape the Navigation Bar of a website while maintaining hierarchy of contents,0,1
Scrape img src with try/except in beautifulsoup,votes,24
error 'NoneType' object has no attribute 'get_text' [closed],0,0
"Python webscraping with bs4. Some things not work, probably my if statement. Code and description inside",votes,1
How to avoid error: 'NoneType' object has no attribute 'text'?,0,40
How to scrape only texts from specific HTML elements?,votes,0
"Inconsistently getting ""Exception has occurred: JavascriptException"" error selenium",0,0
Loop through URL using Python,votes,19
parse tr in style component using beautifulsoup,-2,-1
How to scrape a site by loading content via triggering load more button?,votes,0
How To Scrape Content With Load More Pages Using Selenium Python,-2,36
Selenium not able to grab Best Buy price? [closed],votes,0
HTTPError 405 while scraping on web server(ssh) but works well on vs code terminal [closed],2,2
Ebay Item Description Scrape [closed],votes,37
Why do I get an empty list when I web-scrape customer reviews from Amazon(using BeautifulSoup)?,-2,0
How can I get javascript function parameters from html by python?,votes,1
Output from web scraping with bs4 returns empty lists,1,27
Perserving source html entities with BeautifulSoup,vote,0
How to get src in an image using class?,1,1
Is there a way to more accurately search for a class with BeautifulSoup,vote,35
Python How to get the tag value without the tag xml,0,0
How to separate data per column when writing data to excel from web scraping results,votes,1
How to extract hidden table data from job-postings using BeautifulSoup?,1,19
Can't find element using selenium and bs,vote,-2
Is there anyone who's able to get through this scraping protection? [closed],1,1
How to scrap a table from a website without a specific tag?,vote,31
BeautifulSoup4 prints data twice,-2,-2
For loop over beautifulsoup FindAll results [closed],votes,0
